v2.9.1/cash-account-cobol/cash-account-cobol_galaxy_gpu.json

{"meta":{"zero_dependency_mode":true,"missing_dependencies":{"tiktoken":true,"numpy":false,"pandas":true,"xgboost":true,"pyyaml":false},"schemas":{"galaxy_columns":["names","paths","lang_ids","locs","m_locs","d_locs","mass","author_distribution","ownership_entropy","raw_churn_freq","cog_raw","pos_x","pos_y","pos_z","risks_flat","hits_flat","tel_aid","tel_pid","tel_purp","tel_lt","tel_pop","tel_cfr","ai_threats","satellite_data_flat","satellite_offsets","imports","c_ids","a_ids","a_dists","edges","outbound_edges"],"singularity_columns":["paths","exts","reasons","sizes","confidences"],"risk_vector_x1000":["cognitive_load","safety_score","tech_debt","verification","api_exposure","concurrency","state_flux","dead_code","spec_match","stability","churn","documentation","secrets_risk"],"hit_vector":["branch","structural_boundaries","args","func_start","class_start","safety","safety_bypasses","high_risk_execution","io","api","state_mutation","dead_code","doc","test","concurrency","ui_framework","closures","globals","decorators","generics","comprehensions","scientific","reflection_metaprogramming","import","ownership","planned_debt","fragile_debt","spec_exposure","ssr_boundaries","events","dependency_injection","macros","pointers","memory_alloc","inline_asm","telemetry","debug_prints","explicit_casts","panics_and_aborts","thread_sleeps","bitwise_ops","sync_locks","immutability_locks","cleanup","encapsulation","listeners","test_skip","indent_tabs","indent_spaces","hardware_bridge","cryptography","auth_middleware","ipc_rpc_bridges","feature_flags","serialization_parsing","regex_execution","time_date_logic","llm_api","llm_orchestrator","llm_vector_store","llm_local_compute","ml_traditional","dl_frameworks","lazy_evaluation","vectorized_math","core_var_decl","design_camel_case","design_snake_case","design_pascal_case","design_upper_case","design_short_vars","design_long_vars","duplicate_logic","unreferenced_by_name","lit_code_blocks","lit_diagrams","lit_headers","lit_links","sec_reflection_metaprogramming","sec_safety_bypasses","sec_io","sec_high_risk_execution","sec_state_mutation","sec_dead_code","sec_bitwise_ops","sec_shadow_imports","sec_homoglyphs","sec_hardcoded_secrets","sec_extension_mismatch","sec_entropy","sec_tainted_injection","prompt_injection","agentic_rce","sec_unicode_steganography","sec_self_propagation","sec_db_hooks","sec_amplified_sql_injection","system_config_mutation"],"satellites":["name","loc","branch","angle_x10","args","type_id","control_flow_x1000","mag_x10","start_line","end_line","docstring"],"scalars":{"exposure":1000,"physics":10},"lookups":{"languages":["markdown","jcl","cobol"],"textures":["standard","crystalline","plates","digital","metallic","necrosis","io","check","verification","mutation","event","logic","high_risk_execution"],"authors":["John Alcorn","Unknown Architect"],"proofs":["Prose Extension (.md)","Single Indicator (Ext: .jcl)","Single Indicator (Ext: .cpy)","Single Indicator (Ext: .cbl)"],"purposes":["Standard Logic Matrix"],"reasons":["Blocked (Explicitly Denied Extension: '.png')","Blocked (System Exclusion, Hidden Directory, or Dynamic Ignored Dir)"],"exts":[".png","none"],"imports":["architecture-diagram.png","SYS1.DSND00A.SDSNLOAD","SYSD.STOCK.DBRMLIB","DCLCASH","DCLFRANK","SQLCA"],"constellations":["__monolith__","VSAM","DB2-DDL","COBOL"],"archetypes":["Static: Literature & Documentation","file_cluster_2"]}},"session":{"engine":"GitGalaxy Scope vlatest (Delta Mode)","target":"cash-account-cobol","timestamp":"2026-09-19T13:53:15.202685+00:00","duration_seconds":0.07,"target_directory":"/nvme-data/gitgalaxy-data/corpus_cobol/cash-account-cobol","git_audit":{"branch":"main","commit_hash":"c35db0d1f283367109bcd5dfadd76560cf53b2dc","remote_url":"https://github.com/IBMStockTrader/cash-account-cobol.git","latest_commit_date":"2025-10-07T13:25:55-04:00"},"missing_dependencies":{"tiktoken":true,"numpy":false,"pandas":true,"xgboost":true,"pyyaml":false},"zero_dependency_mode":true,"ml_inference_ran":false}},"global_summary":{"summary":{"total_files":9,"verified_files":7,"total_loc":384,"dominant_language":"cobol","volatility_index":0.143,"Percent_Visible":77.8,"repo_composition_archetype":"Micro Repo (<30 files)","repo_composition_z":0.0,"file_composition_distribution":{"Large Core Modules":4,"Declarative / Non-Code":2,"Data / Markup / Trivial":1}},"repo_macro_species":{"name":"Micro Repo (<30 files)","z_score":0.0},"unparsable_files":{"ambig_file_count":2,"size_limit":0,"binary":0,"unparsable":0,"os_permissions":0,"composition_by_extension_and_reason":{"no_extension":{"Blocked (System Exclusion, Hidden Directory, or Dynamic Ignored Dir)":1},".png":{"Blocked (Explicitly Denied Extension: '.png')":1}},"breakdown":{"binary":0,"unparsable":0,"no_extension":0,"size_limit":0,"os_permissions":0,"Format [unknown]":{"count":1,"details":{"Blocked (System Exclusion, Hidden Directory, or Dynamic Ignored Dir)":1}},"Format [.png]":{"count":1,"details":{"Blocked (Explicitly Denied Extension: '.png')":1}}}},"health":{"avg_cognitive_load":13.03,"avg_safety_score":34.958,"avg_tech_debt":0.0,"avg_documentation":57.143},"composition":{"cobol":{"files":3,"loc":246,"impact":124.27000000000001},"jcl":{"files":3,"loc":138,"impact":15.760000000000002},"markdown":{"files":1,"loc":0,"impact":1.0}},"ecosystem_fingerprint":{"ml_clusters":{"Unclassified":{"count":6,"pct":85.7}},"static_mass":{"Static: Literature & Documentation":{"count":1,"pct":14.3}}},"ai_topology":{"classification":"Non-AI / Traditional","insights":[]},"directory_groups":{"COBOL":{"file_count":3,"total_mass":124.27,"avg_exposures":{"cognitive_load":30.4,"safety_score":30.12,"tech_debt":0.0,"verification":2.32,"api_exposure":0.82,"concurrency":0.0,"state_flux":33.33,"dead_code":0.0,"spec_match":0.0,"stability":0.0,"churn":0.0,"documentation":33.33,"secrets_risk":0.0}},"DB2-DDL":{"file_count":2,"total_mass":13.88,"avg_exposures":{"cognitive_load":0.0,"safety_score":77.17,"tech_debt":0.0,"verification":2.37,"api_exposure":0.0,"concurrency":0.0,"state_flux":0.0,"dead_code":0.0,"spec_match":0.0,"stability":0.0,"churn":0.0,"documentation":100.0,"secrets_risk":0.0}},"VSAM":{"file_count":1,"total_mass":1.88,"avg_exposures":{"cognitive_load":0.0,"safety_score":0.0,"tech_debt":0.0,"verification":2.32,"api_exposure":0.0,"concurrency":0.0,"state_flux":0.0,"dead_code":0.0,"spec_match":0.0,"stability":0.0,"churn":0.0,"documentation":100.0,"secrets_risk":0.0}},"__monolith__":{"file_count":1,"total_mass":1.0,"avg_exposures":{"cognitive_load":0.0,"safety_score":0.0,"tech_debt":0.0,"verification":0.0,"api_exposure":0.0,"concurrency":0.0,"state_flux":0.0,"dead_code":0.0,"spec_match":0.0,"stability":0.0,"churn":100.0,"documentation":0.0,"secrets_risk":0.0}}},"network_macro":{"modularity":0.0,"assortativity":0.0,"cyclic_density":0.0,"avg_path_length":1.0,"articulation_points":1},"ecosystem_audits":{"api_mapper":{"status":"no_swagger","shadow_count":0,"ghost_count":0},"xray":{"anomalies_found":0},"firewall":{"imports_whitelisted":0,"imports_unknown":7,"imports_blacklisted":0,"threats_found":0,"threats_allowed":0}},"typosquat_hits":0,"Global Architectural Fingerprint":{"Active Execution Logic (ML Clusters)":{"Unclassified":"85.7% (6 files)"},"Static Assets (Static Categories)":{"Static: Literature & Documentation":"14.3% (1 files)"}},"Function Archetype Distribution":{"I/O & Config Routines":"100.0% (12)"},"Repository Ecosystem Baseline (Architecture)":{"Classification":"Micro Repo (<30 files)","Architectural Drift (Z-Score)":0.0},"Repository Composition Archetype":"Micro Repo (<30 files)","Repository Composition Fit (Z-Score)":0.0,"File Composition Distribution":{"Large Core Modules":"57.1% (4)","Declarative / Non-Code":"28.6% (2)","Data / Markup / Trivial":"14.3% (1)"}},"galaxy":{"names":["README.md","DEFKSDS.jcl","DB2DDL.jcl","DB2BIND.jcl","DCLFRANK.cpy","DCLCASH.cpy","CASH00.cbl"],"paths":["README.md","VSAM/DEFKSDS.jcl","DB2-DDL/DB2DDL.jcl","DB2-DDL/DB2BIND.jcl","COBOL/DCLFRANK.cpy","COBOL/DCLCASH.cpy","COBOL/CASH00.cbl"],"lang_ids":[0,1,1,1,2,2,2],"locs":[7,17,104,47,27,23,270],"m_locs":[0,14,83,41,13,9,224],"d_locs":[4,3,17,3,13,13,1],"mass":[10,19,100,39,8,7,1228],"author_distribution":[0,0,0,0,0,0,0],"ownership_entropy":[0,0,0,0,0,0,0],"raw_churn_freq":[1000,0,0,0,0,0,0],"cog_raw":[0,0,0,0,0,0,1335],"pos_x":[1551,-8863,-91,-2350,7678,9990,9560],"pos_y":[-1365,1888,1416,1471,-2529,-1988,-1969],"pos_z":[-9027,-1687,9632,11971,464,-2028,-1009],"risks_flat":[-10,-10,-10,-10,-10,-10,-10,-10,-10,-10,-10,-10,-10,0,0,0,23,0,0,0,0,0,0,0,1000,0,0,614,0,23,0,0,0,0,0,0,0,1000,0,0,929,0,23,0,0,0,0,0,0,0,1000,0,0,0,0,22,0,0,0,0,0,0,0,0,0,0,0,0,22,0,0,0,0,0,0,0,0,0,912,903,0,23,24,0,999,0,0,0,0,1000,0],"hits_flat":[0,0,0,0,0,0,0,0,0,0,0,0,0,0,0,0,0,0,0,0,0,0,0,0,0,0,0,0,0,0,0,0,0,0,0,0,0,0,0,0,0,0,0,0,0,0,0,0,0,0,0,0,0,0,0,0,0,0,0,0,0,0,0,0,0,0,0,0,0,0,0,0,0,0,0,0,1,3,0,0,0,0,0,0,0,0,0,0,0,0,0,0,0,0,0,0,0,0,0,2,0,1,1,0,0,0,1,0,0,0,0,0,0,0,0,0,0,0,0,0,0,0,0,0,0,0,0,0,0,0,0,0,0,2,0,0,0,0,0,0,0,0,0,0,0,0,8,0,0,0,0,0,0,0,0,0,0,0,0,0,0,0,0,3,0,0,0,3,0,0,0,0,0,0,0,0,0,0,0,0,0,0,0,0,0,0,0,0,0,0,0,0,0,0,0,0,0,21,0,4,1,3,0,4,13,0,0,0,0,0,0,0,0,1,0,0,0,0,0,0,0,0,0,0,0,0,0,0,0,0,0,2,0,0,0,0,0,0,0,0,0,0,0,0,44,0,0,0,0,0,0,0,0,0,0,0,0,0,0,0,0,22,0,0,0,22,0,0,0,0,0,0,0,0,0,0,0,8,0,0,0,0,0,0,0,0,0,0,0,0,0,0,0,0,0,7,0,1,1,0,0,3,5,0,0,0,0,0,0,0,0,0,0,0,0,0,0,0,0,0,0,0,0,0,0,0,0,0,0,2,0,0,0,0,0,0,0,0,0,0,0,0,24,0,0,0,0,0,0,0,0,0,0,0,0,0,0,0,0,7,0,0,0,7,0,0,0,0,0,0,0,0,0,0,0,2,0,0,0,0,0,0,0,0,0,0,0,0,0,0,0,0,0,0,0,0,0,0,0,0,1,0,0,0,0,0,0,0,0,0,0,0,0,0,1,0,0,0,0,0,0,0,0,0,0,0,0,0,0,0,0,0,0,0,0,0,0,0,0,0,13,0,0,0,1,0,0,0,0,0,0,0,0,0,0,0,0,0,0,0,0,0,0,0,0,0,0,0,0,0,0,0,0,0,0,0,0,0,0,0,0,0,0,0,0,0,0,0,0,0,0,0,0,0,0,0,0,0,1,0,0,0,0,0,0,0,0,0,0,0,0,0,1,0,0,0,0,0,0,0,0,0,0,0,0,0,0,0,0,0,0,0,0,0,0,0,0,0,9,0,0,0,1,0,0,0,0,0,0,0,0,0,0,0,0,0,0,0,0,0,0,0,0,0,0,0,0,0,0,0,0,0,0,0,0,0,0,0,0,0,0,0,0,0,0,0,0,0,21,19,0,6,1,6,2,0,21,1,47,0,0,0,0,0,0,0,0,0,0,0,22,3,0,0,0,0,0,0,0,0,0,0,0,0,6,1,0,0,0,0,0,1,0,0,2,0,215,0,0,0,16,0,0,0,2,0,0,0,0,0,0,0,0,12,0,1,0,11,0,0,0,0,0,0,0,0,0,0,0,0,0,0,0,0,0,0,0,0,0,0,0,0,0,0,0,0],"tel_aid":[0,1,1,1,1,1,1],"tel_pid":[0,1,1,1,2,2,3],"tel_purp":[0,0,0,0,0,0,0],"tel_lt":[1,2,2,2,2,2,2],"tel_pop":[0,0,0,0,1,1,0],"tel_cfr":[0,0,0,0,0,0,94],"ai_threats":[0,0,0,0,0,0,0],"satellite_data_flat":["STEPNAME",12,0,900,0,6,0,16,6,17,"CRTABS",27,0,900,0,12,0,24,36,62,"CREATE",24,0,900,0,12,0,22,8,31,"CRINDX",17,0,900,0,12,0,19,87,103,"CRGRACC",15,0,900,0,12,0,18,68,82,"BIND",41,0,900,0,12,0,31,6,46,"CASH-ACCT-CREDIT",33,2,225,0,6,1000,45,204,236,"CASH-ACCT-DEBIT",32,2,225,0,6,1000,45,238,269,"CASH-ACCT-UPDATE",20,2,225,0,9,1000,40,164,183,"CASH-ACCT-DELETE",18,2,225,0,9,1000,39,185,202,"CASH-ACCT-READ",15,2,225,0,6,1000,38,136,150,"CASH-ACCT-ADD",12,2,225,0,6,1000,36,151,162],"satellite_offsets":[0,0,1,5,6,6,6,12],"imports":[[0],[],[1],[1,2],[],[],[3,4,5]],"c_ids":[0,1,2,2,3,3,3],"a_ids":[[0],[1],[1],[1],[1],[1],[1]],"a_dists":[[0],[0],[0],[0],[0],[0],[0]],"edges":[[],[],[],[],[6],[6],[]],"outbound_edges":[[],[],[],[],[],[],[4,5]]},"singularity":{"paths":["architecture-diagram.png","LICENSE"],"exts":[0,1],"reasons":[0,1],"sizes":[431827,11357],"confidences":[0,0]},"story":{"status":"","why":"","who":"","significance":"","link":"","artifacts":[{"title":"","url":"","description":""}]}}

v2.8.1/@azure_msal-node/@azure_msal-node_galaxy_llm.md

### `package/src/client/OnBehalfOfClient.ts` (TYPESCRIPT | Tier 2 | AI Safe: 0.0%)

- **Global Archetype:** `file_cluster_2` (Drift: 0.0 IQR)
- **Magnitude:** 119.78 | **LOC:** 416 | **CtrlFlow:** 8.3% | **Authorship Centralization:** 0.0%
- **Risk Profile:** Cognitive Load (17.3333%), Tech Debt (9.3764%)
**Top Internal Functions/Classes:**
  * `getCachedAuthenticationResult` **(Compute Cores)** (Impact: 19.9)
    * *Intent:* /** * look up cache for tokens * Find idtoken in the cache * Find accessToken based on user assertio...
  * `createTokenRequestBody` **(Compute Cores)** (Impact: 15.8)
    * *Intent:* /** * generate a server request in accepable format * @param request - developer provided CommonOnBe...
  * `readAccessTokenFromCacheForOBO` **(Compute Cores)** (Impact: 14.3)
    * *Intent:* /** * Fetches the cached access token based on incoming assertion * @param clientId - client id * @p...
  * `acquireToken` **(Defensive Guards)** (Impact: 7.1)
    * *Intent:* /** * Public API to acquire tokens with on behalf of flow * @param request - developer provided Comm...
  * `executeTokenRequest` **(Many-Argument Workhorses)** (Impact: 5.0)
    * *Intent:* /** * Make a network call to the server requesting credentials * @param request - developer provided...
**Contextual Mitigations & Amplifications:**
* *Amplified Race Conditions:* 3 instances
* *Amplified Cascading Flux:* 4 instances
* *Concurrency (weighted view):* 30
* *State Mutation (weighted view):* 12
**Structural Signatures (Net Mitigated Signals):**
* *Structure:* `branch: 27`, `structural_boundaries: 25`, `args: 7`, `func_start: 7`, `class_start: 1`
* *Risk/State:* `state_mutation: 4`, `planned_debt: 1`
* *Architecture:* `api: 3`, `concurrency: 15`, `import: 5`
* *Defense:* `safety: 5`, `doc: 7`
* *Network Topology:*
  * `Ecosystem Role:` Isolated/Orphan | `Dependency Blast Radius (PageRank):` 12.987
  * `Choke Point (Betweenness):` 0.0 | `Ripple Effect (Closeness):` 0.0
  * `Imports (Out-Degree: 0):` CommonOnBehalfOfRequest.js, Constants.js, EncodingUtils.js, BaseClient.js, node
  * `Imported By (In-Degree: 0):` None (Orphan / Entrypoint)

### `package/src/client/DeviceCodeClient.ts` (TYPESCRIPT | Tier 2 | AI Safe: 0.0%)

- **Global Archetype:** `file_cluster_2` (Drift: 0.0 IQR)
- **Magnitude:** 110.66 | **LOC:** 415 | **CtrlFlow:** 9.5% | **Authorship Centralization:** 0.0%
- **Risk Profile:** Cognitive Load (7.5952%), Tech Debt (0.0%)
**Top Internal Functions/Classes:**
  * `continuePolling` **(Many-Argument Workhorses)** (Impact: 30.1)
    * *Intent:* /** * Breaks the polling with specific conditions * @param deviceCodeExpirationTime - expiration tim...
  * `acquireTokenWithDeviceCode` **(Many-Argument Workhorses)** (Impact: 20.2)
    * *Intent:* /** * Creates token request with device code response and polls token endpoint at interval set by th...
  * `createTokenRequestBody` **(Many-Argument Workhorses)** (Impact: 13.0)
    * *Intent:* /** * Creates query parameters and converts to string. * @param request - developer provided CommonD...
  * `createQueryString` **(Compute Cores)** (Impact: 8.6)
    * *Intent:* /** * Create device code endpoint query parameters and returns string * @param request - developer p...
  * `executePostRequestToDeviceCodeEndpoint` **(Many-Argument Workhorses)** (Impact: 4.2)
    * *Intent:* /** * Executes POST request to device code endpoint * @param deviceCodeEndpoint - token endpoint * @...
**Structural Signatures (Net Mitigated Signals):**
* *Structure:* `branch: 31`, `structural_boundaries: 22`, `args: 9`, `func_start: 9`, `class_start: 1`
* *Risk/State:* `dead_code: 1`
* *Architecture:* `api: 4`, `concurrency: 13`, `import: 5`
* *Defense:* `doc: 9`
* *Network Topology:*
  * `Ecosystem Role:` Isolated/Orphan | `Dependency Blast Radius (PageRank):` 12.987
  * `Choke Point (Betweenness):` 0.0 | `Ripple Effect (Closeness):` 0.0
  * `Imports (Out-Degree: 0):` ClientAuthErrorCodes.js, CommonDeviceCodeRequest.js, Constants.js, BaseClient.js, node
  * `Imported By (In-Degree: 0):` None (Orphan / Entrypoint)

### `package/src/client/ManagedIdentitySources/AzureArc.ts` (TYPESCRIPT | Tier 2 | AI Safe: 0.0%)

- **Global Archetype:** `file_cluster_10` (Drift: 0.0 IQR)
- **Magnitude:** 103.06 | **LOC:** 416 | **CtrlFlow:** 7.2% | **Authorship Centralization:** 0.0%
- **Risk Profile:** Cognitive Load (10.9633%), Tech Debt (29.2343%)
**Top Internal Functions/Classes:**
  * `getServerTokenResponseAsync` **(Many-Argument Workhorses)** (Impact: 30.4)
    * *Intent:* * @param networkClient - Network client for making the retry request if needed * @param networkReque...
  * `tryCreate` **(Many-Argument Workhorses)** (Impact: 24.8)
    * *Intent:* * are supported for Azure Arc scenarios. The method performs comprehensive validation of * endpoint ...
  * `getEnvironmentVariables` **(I/O & Config Routines)** (Impact: 4.8)
    * *Intent:* /** * Retrieves and validates Azure Arc environment variables for managed identity configuration. * ...
  * `constructor` **(Many-Argument Workhorses)** (Impact: 3.5)
    * *Intent:* /** * Creates a new instance of the AzureArc managed identity source. * * @param logger - Logger ins...
  * `createRequest` **(I/O & Config Routines)** (Impact: 2.3)
    * *Intent:* /** * Creates a properly formatted HTTP request for acquiring tokens from the Azure Arc identity end...
**Contextual Mitigations & Amplifications:**
* *Amplified Race Conditions:* 2 instances
* *Concurrency (weighted view):* 14
**Structural Signatures (Net Mitigated Signals):**
* *Structure:* `branch: 19`, `structural_boundaries: 27`, `args: 5`, `func_start: 5`, `class_start: 1`
* *Risk/State:* `state_mutation: 9`, `dead_code: 2`, `unreferenced_by_name: 4`
* *Architecture:* `io: 5`, `api: 9`, `concurrency: 4`, `import: 11`
* *Defense:* `safety: 11`, `doc: 6`
* *Network Topology:*
  * `Ecosystem Role:` Isolated/Orphan | `Dependency Blast Radius (PageRank):` 12.987
  * `Choke Point (Betweenness):` 0.0 | `Ripple Effect (Closeness):` 0.0
  * `Imports (Out-Degree: 0):` NodeStorage.js, ManagedIdentityId.js, ManagedIdentityRequestParameters.js, CryptoProvider.js, ManagedIdentityError.js, ManagedIdentityTokenResponse.js, Constants.js, BaseManagedIdentitySource.js...
  * `Imported By (In-Degree: 0):` None (Orphan / Entrypoint)